{
    "number": 61,
    "name_arabic": "الصف",
    "name_english": "The Ranks",
    "name_transliteration": "As-Saf",
    "revelation_type": "medinan",
    "beginner_intro": "As-Saf (\"The Ranks\") is a Medinan surah of 14 ayahs. Arabic text: Tanzil Project (Uthmani script). Translation: Pickthall (public domain).",
    "ayahs": [
        {
            "number_in_surah": 1,
            "juz": 28,
            "page": 551,
            "arabic_text": "سَبَّحَ لِلَّهِ مَا فِى ٱلسَّمَـٰوَٰتِ وَمَا فِى ٱلْأَرْضِ ۖ وَهُوَ ٱلْعَزِيزُ ٱلْحَكِيمُ",
            "translations": [
                {
                    "translator": "Pickthall",
                    "text": "All that is in the heavens and all that is in the earth glorifieth Allah, and He is the Mighty, the Wise."
                }
            ]
        },
        {
            "number_in_surah": 2,
            "juz": 28,
            "page": 551,
            "arabic_text": "يَـٰٓأَيُّهَا ٱلَّذِينَ ءَامَنُوا۟ لِمَ تَقُولُونَ مَا لَا تَفْعَلُونَ",
            "translations": [
                {
                    "translator": "Pickthall",
                    "text": "O ye who believe! Why say ye that which ye do not?"
                }
            ]
        },
        {
            "number_in_surah": 3,
            "juz": 28,
            "page": 551,
            "arabic_text": "كَبُرَ مَقْتًا عِندَ ٱللَّهِ أَن تَقُولُوا۟ مَا لَا تَفْعَلُونَ",
            "translations": [
                {
                    "translator": "Pickthall",
                    "text": "It is most hateful in the sight of Allah that ye say that which ye do not."
                }
            ]
        },
        {
            "number_in_surah": 4,
            "juz": 28,
            "page": 551,
            "arabic_text": "إِنَّ ٱللَّهَ يُحِبُّ ٱلَّذِينَ يُقَـٰتِلُونَ فِى سَبِيلِهِۦ صَفًّا كَأَنَّهُم بُنْيَـٰنٌ مَّرْصُوصٌ",
            "translations": [
                {
                    "translator": "Pickthall",
                    "text": "Lo! Allah loveth them who battle for His cause in ranks, as if they were a solid structure."
                }
            ]
        },
        {
            "number_in_surah": 5,
            "juz": 28,
            "page": 551,
            "arabic_text": "وَإِذْ قَالَ مُوسَىٰ لِقَوْمِهِۦ يَـٰقَوْمِ لِمَ تُؤْذُونَنِى وَقَد تَّعْلَمُونَ أَنِّى رَسُولُ ٱللَّهِ إِلَيْكُمْ ۖ فَلَمَّا زَاغُوٓا۟ أَزَاغَ ٱللَّهُ قُلُوبَهُمْ ۚ وَٱللَّهُ لَا يَهْدِى ٱلْقَوْمَ ٱلْفَـٰسِقِينَ",
            "translations": [
                {
                    "translator": "Pickthall",
                    "text": "And (remember) when Moses said unto his people: O my people! Why persecute ye me, when ye well know that I am Allah's messenger unto you? So when they went astray Allah sent their hearts astray. And Allah guideth not the evil-living folk."
                }
            ]
        },
        {
            "number_in_surah": 6,
            "juz": 28,
            "page": 552,
            "arabic_text": "وَإِذْ قَالَ عِيسَى ٱبْنُ مَرْيَمَ يَـٰبَنِىٓ إِسْرَٰٓءِيلَ إِنِّى رَسُولُ ٱللَّهِ إِلَيْكُم مُّصَدِّقًا لِّمَا بَيْنَ يَدَىَّ مِنَ ٱلتَّوْرَىٰةِ وَمُبَشِّرًۢا بِرَسُولٍ يَأْتِى مِنۢ بَعْدِى ٱسْمُهُۥٓ أَحْمَدُ ۖ فَلَمَّا جَآءَهُم بِٱلْبَيِّنَـٰتِ قَالُوا۟ هَـٰذَا سِحْرٌ مُّبِينٌ",
            "translations": [
                {
                    "translator": "Pickthall",
                    "text": "And when Jesus son of Mary said: O Children of Israel! Lo! I am the messenger of Allah unto you, confirming that which was (revealed) before me in the Torah, and bringing good tidings of a messenger who cometh after me, whose name is the Praised One. Yet when he hath come unto them with clear proofs, they say: This is mere magic."
                }
            ]
        },
        {
            "number_in_surah": 7,
            "juz": 28,
            "page": 552,
            "arabic_text": "وَمَنْ أَظْلَمُ مِمَّنِ ٱفْتَرَىٰ عَلَى ٱللَّهِ ٱلْكَذِبَ وَهُوَ يُدْعَىٰٓ إِلَى ٱلْإِسْلَـٰمِ ۚ وَٱللَّهُ لَا يَهْدِى ٱلْقَوْمَ ٱلظَّـٰلِمِينَ",
            "translations": [
                {
                    "translator": "Pickthall",
                    "text": "And who doeth greater wrong than he who inventeth a lie against Allah when he is summoned unto Al-Islam? And Allah guideth not wrongdoing folk."
                }
            ]
        },
        {
            "number_in_surah": 8,
            "juz": 28,
            "page": 552,
            "arabic_text": "يُرِيدُونَ لِيُطْفِـُٔوا۟ نُورَ ٱللَّهِ بِأَفْوَٰهِهِمْ وَٱللَّهُ مُتِمُّ نُورِهِۦ وَلَوْ كَرِهَ ٱلْكَـٰفِرُونَ",
            "translations": [
                {
                    "translator": "Pickthall",
                    "text": "Fain would they put out the light of Allah with their mouths, but Allah will perfect His light however much the disbelievers are averse."
                }
            ]
        },
        {
            "number_in_surah": 9,
            "juz": 28,
            "page": 552,
            "arabic_text": "هُوَ ٱلَّذِىٓ أَرْسَلَ رَسُولَهُۥ بِٱلْهُدَىٰ وَدِينِ ٱلْحَقِّ لِيُظْهِرَهُۥ عَلَى ٱلدِّينِ كُلِّهِۦ وَلَوْ كَرِهَ ٱلْمُشْرِكُونَ",
            "translations": [
                {
                    "translator": "Pickthall",
                    "text": "He it is Who hath sent His messenger with the guidance and the religion of truth, that He may make it conqueror of all religion however much idolaters may be averse."
                }
            ]
        },
        {
            "number_in_surah": 10,
            "juz": 28,
            "page": 552,
            "arabic_text": "يَـٰٓأَيُّهَا ٱلَّذِينَ ءَامَنُوا۟ هَلْ أَدُلُّكُمْ عَلَىٰ تِجَـٰرَةٍ تُنجِيكُم مِّنْ عَذَابٍ أَلِيمٍ",
            "translations": [
                {
                    "translator": "Pickthall",
                    "text": "O ye who believe! Shall I show you a commerce that will save you from a painful doom?"
                }
            ]
        },
        {
            "number_in_surah": 11,
            "juz": 28,
            "page": 552,
            "arabic_text": "تُؤْمِنُونَ بِٱللَّهِ وَرَسُولِهِۦ وَتُجَـٰهِدُونَ فِى سَبِيلِ ٱللَّهِ بِأَمْوَٰلِكُمْ وَأَنفُسِكُمْ ۚ ذَٰلِكُمْ خَيْرٌ لَّكُمْ إِن كُنتُمْ تَعْلَمُونَ",
            "translations": [
                {
                    "translator": "Pickthall",
                    "text": "Ye should believe in Allah and His messenger, and should strive for the cause of Allah with your wealth and your lives. That is better for you, if ye did but know."
                }
            ]
        },
        {
            "number_in_surah": 12,
            "juz": 28,
            "page": 552,
            "arabic_text": "يَغْفِرْ لَكُمْ ذُنُوبَكُمْ وَيُدْخِلْكُمْ جَنَّـٰتٍ تَجْرِى مِن تَحْتِهَا ٱلْأَنْهَـٰرُ وَمَسَـٰكِنَ طَيِّبَةً فِى جَنَّـٰتِ عَدْنٍ ۚ ذَٰلِكَ ٱلْفَوْزُ ٱلْعَظِيمُ",
            "translations": [
                {
                    "translator": "Pickthall",
                    "text": "He will forgive you your sins and bring you into Gardens underneath which rivers flow, and pleasant dwellings in Gardens of Eden. That is the supreme triumph."
                }
            ]
        },
        {
            "number_in_surah": 13,
            "juz": 28,
            "page": 552,
            "arabic_text": "وَأُخْرَىٰ تُحِبُّونَهَا ۖ نَصْرٌ مِّنَ ٱللَّهِ وَفَتْحٌ قَرِيبٌ ۗ وَبَشِّرِ ٱلْمُؤْمِنِينَ",
            "translations": [
                {
                    "translator": "Pickthall",
                    "text": "And (He will give you) another (blessing) which ye love: help from Allah and present victory. Give good tidings (O Muhammad) to believers."
                }
            ]
        },
        {
            "number_in_surah": 14,
            "juz": 28,
            "page": 552,
            "arabic_text": "يَـٰٓأَيُّهَا ٱلَّذِينَ ءَامَنُوا۟ كُونُوٓا۟ أَنصَارَ ٱللَّهِ كَمَا قَالَ عِيسَى ٱبْنُ مَرْيَمَ لِلْحَوَارِيِّـۧنَ مَنْ أَنصَارِىٓ إِلَى ٱللَّهِ ۖ قَالَ ٱلْحَوَارِيُّونَ نَحْنُ أَنصَارُ ٱللَّهِ ۖ فَـَٔامَنَت طَّآئِفَةٌ مِّنۢ بَنِىٓ إِسْرَٰٓءِيلَ وَكَفَرَت طَّآئِفَةٌ ۖ فَأَيَّدْنَا ٱلَّذِينَ ءَامَنُوا۟ عَلَىٰ عَدُوِّهِمْ فَأَصْبَحُوا۟ ظَـٰهِرِينَ",
            "translations": [
                {
                    "translator": "Pickthall",
                    "text": "O ye who believe! Be Allah's helpers, even as Jesus son of Mary said unto the disciples: Who are my helpers for Allah? They said: We are Allah's helpers. And a party of the Children of Israel believed, while a party disbelieved. Then We strengthened those who believed against their foe, and they became the uppermost."
                }
            ]
        }
    ]
}
