{
    "number": 62,
    "name_arabic": "الجمعة",
    "name_english": "The Congregation, Friday",
    "name_transliteration": "Al-Jumu'ah",
    "revelation_type": "medinan",
    "beginner_intro": "Al-Jumu'ah (\"The Congregation, Friday\") is a Medinan surah of 11 ayahs. Arabic text: Al-Quran Hafazan System (Uthmani Hafs script). Translation: Pickthall (public domain).",
    "ayahs": [
        {
            "number_in_surah": 1,
            "juz": 28,
            "page": 553,
            "arabic_text": "بِسْمِ ٱللَّهِ ٱلرَّحْمَٰنِ ٱلرَّحِيمِ يُسَبِّحُ لِلَّهِ مَا فِى ٱلسَّمَٰوَٰتِ وَمَا فِى ٱلْأَرْضِ ٱلْمَلِكِ ٱلْقُدُّوسِ ٱلْعَزِيزِ ٱلْحَكِيمِ",
            "translations": [
                {
                    "translator": "Pickthall",
                    "text": "All that is in the heavens and all that is in the earth glorifieth Allah, the Sovereign Lord, the Holy One, the Mighty, the Wise."
                }
            ]
        },
        {
            "number_in_surah": 2,
            "juz": 28,
            "page": 553,
            "arabic_text": "هُوَ ٱلَّذِى بَعَثَ فِى ٱلْأُمِّيِّۦنَ رَسُولًۭا مِّنْهُمْ يَتْلُوا۟ عَلَيْهِمْ ءَايَٰتِهِۦ وَيُزَكِّيهِمْ وَيُعَلِّمُهُمُ ٱلْكِتَٰبَ وَٱلْحِكْمَةَ وَإِن كَانُوا۟ مِن قَبْلُ لَفِى ضَلَٰلٍۢ مُّبِينٍۢ",
            "translations": [
                {
                    "translator": "Pickthall",
                    "text": "He it is Who hath sent among the unlettered ones a messenger of their own, to recite unto them His revelations and to make them grow, and to teach them the Scripture and wisdom, though heretofore they were indeed in error manifest,"
                }
            ]
        },
        {
            "number_in_surah": 3,
            "juz": 28,
            "page": 553,
            "arabic_text": "وَءَاخَرِينَ مِنْهُمْ لَمَّا يَلْحَقُوا۟ بِهِمْ ۚ وَهُوَ ٱلْعَزِيزُ ٱلْحَكِيمُ",
            "translations": [
                {
                    "translator": "Pickthall",
                    "text": "Along with others of them who have not yet joined them. He is the Mighty, the Wise."
                }
            ]
        },
        {
            "number_in_surah": 4,
            "juz": 28,
            "page": 553,
            "arabic_text": "ذَٰلِكَ فَضْلُ ٱللَّهِ يُؤْتِيهِ مَن يَشَآءُ ۚ وَٱللَّهُ ذُو ٱلْفَضْلِ ٱلْعَظِيمِ",
            "translations": [
                {
                    "translator": "Pickthall",
                    "text": "That is the bounty of Allah; which He giveth unto whom He will. Allah is of Infinite Bounty."
                }
            ]
        },
        {
            "number_in_surah": 5,
            "juz": 28,
            "page": 553,
            "arabic_text": "مَثَلُ ٱلَّذِينَ حُمِّلُوا۟ ٱلتَّوْرَىٰةَ ثُمَّ لَمْ يَحْمِلُوهَا كَمَثَلِ ٱلْحِمَارِ يَحْمِلُ أَسْفَارًۢا ۚ بِئْسَ مَثَلُ ٱلْقَوْمِ ٱلَّذِينَ كَذَّبُوا۟ بِـَٔايَٰتِ ٱللَّهِ ۚ وَٱللَّهُ لَا يَهْدِى ٱلْقَوْمَ ٱلظَّٰلِمِينَ",
            "translations": [
                {
                    "translator": "Pickthall",
                    "text": "The likeness of those who are entrusted with the Law of Moses, yet apply it not, is as the likeness of the ass carrying books. Wretched is the likeness of folk who deny the revelations of Allah. And Allah guideth not wrongdoing folk."
                }
            ]
        },
        {
            "number_in_surah": 6,
            "juz": 28,
            "page": 553,
            "arabic_text": "قُلْ يَٰٓأَيُّهَا ٱلَّذِينَ هَادُوٓا۟ إِن زَعَمْتُمْ أَنَّكُمْ أَوْلِيَآءُ لِلَّهِ مِن دُونِ ٱلنَّاسِ فَتَمَنَّوُا۟ ٱلْمَوْتَ إِن كُنتُمْ صَٰدِقِينَ",
            "translations": [
                {
                    "translator": "Pickthall",
                    "text": "Say (O Muhammad): O ye who are Jews! If ye claim that ye are favoured of Allah apart from (all) mankind, then long for death if ye are truthful."
                }
            ]
        },
        {
            "number_in_surah": 7,
            "juz": 28,
            "page": 553,
            "arabic_text": "وَلَا يَتَمَنَّوْنَهُۥٓ أَبَدًۢا بِمَا قَدَّمَتْ أَيْدِيهِمْ ۚ وَٱللَّهُ عَلِيمٌۢ بِٱلظَّٰلِمِينَ",
            "translations": [
                {
                    "translator": "Pickthall",
                    "text": "But they will never long for it because of all that their own hands have sent before, and Allah is Aware of evil-doers."
                }
            ]
        },
        {
            "number_in_surah": 8,
            "juz": 28,
            "page": 553,
            "arabic_text": "قُلْ إِنَّ ٱلْمَوْتَ ٱلَّذِى تَفِرُّونَ مِنْهُ فَإِنَّهُۥ مُلَٰقِيكُمْ ۖ ثُمَّ تُرَدُّونَ إِلَىٰ عَٰلِمِ ٱلْغَيْبِ وَٱلشَّهَٰدَةِ فَيُنَبِّئُكُم بِمَا كُنتُمْ تَعْمَلُونَ",
            "translations": [
                {
                    "translator": "Pickthall",
                    "text": "Say (unto them, O Muhammad): Lo! the death from which ye shrink will surely meet you, and afterward ye will be returned unto the Knower of the Invisible and the Visible, and He will tell you what ye used to do."
                }
            ]
        },
        {
            "number_in_surah": 9,
            "juz": 28,
            "page": 554,
            "arabic_text": "يَٰٓأَيُّهَا ٱلَّذِينَ ءَامَنُوٓا۟ إِذَا نُودِىَ لِلصَّلَوٰةِ مِن يَوْمِ ٱلْجُمُعَةِ فَٱسْعَوْا۟ إِلَىٰ ذِكْرِ ٱللَّهِ وَذَرُوا۟ ٱلْبَيْعَ ۚ ذَٰلِكُمْ خَيْرٌۭ لَّكُمْ إِن كُنتُمْ تَعْلَمُونَ",
            "translations": [
                {
                    "translator": "Pickthall",
                    "text": "O ye who believe! When the call is heard for the prayer of the day of congregation, haste unto remembrance of Allah and leave your trading. That is better for you if ye did but know."
                }
            ]
        },
        {
            "number_in_surah": 10,
            "juz": 28,
            "page": 554,
            "arabic_text": "فَإِذَا قُضِيَتِ ٱلصَّلَوٰةُ فَٱنتَشِرُوا۟ فِى ٱلْأَرْضِ وَٱبْتَغُوا۟ مِن فَضْلِ ٱللَّهِ وَٱذْكُرُوا۟ ٱللَّهَ كَثِيرًۭا لَّعَلَّكُمْ تُفْلِحُونَ",
            "translations": [
                {
                    "translator": "Pickthall",
                    "text": "And when the prayer is ended, then disperse in the land and seek of Allah's bounty, and remember Allah much, that ye may be successful."
                }
            ]
        },
        {
            "number_in_surah": 11,
            "juz": 28,
            "page": 554,
            "arabic_text": "وَإِذَا رَأَوْا۟ تِجَٰرَةً أَوْ لَهْوًا ٱنفَضُّوٓا۟ إِلَيْهَا وَتَرَكُوكَ قَآئِمًۭا ۚ قُلْ مَا عِندَ ٱللَّهِ خَيْرٌۭ مِّنَ ٱللَّهْوِ وَمِنَ ٱلتِّجَٰرَةِ ۚ وَٱللَّهُ خَيْرُ ٱلرَّٰزِقِينَ",
            "translations": [
                {
                    "translator": "Pickthall",
                    "text": "But when they spy some merchandise or pastime they break away to it and leave thee standing. Say: That which Allah hath is better than pastime and than merchandise, and Allah is the Best of providers."
                }
            ]
        }
    ]
}
